{
  "name": "Spellcasters Chronicles",
  "version": "0.0.1",
  "developer": "Quantic Dream",
  "publisher": "Quantic Dream",
  "genre": "3v3 Deckbuilder RTS MOBA",
  "monetization": "Free to Play (Cosmetic Microtransactions)",
  "description": "Spellcasters Chronicles is a 3v3 Deckbuilder RTS MOBA where players create decks of Heroes, Titans, and cards (Spells, Buildings, Creatures) to battle for control of the lanes.",
  "links": {
    "homepage": "https://www.spellcasterschronicles.com/en-US",
    "steam": "https://store.steampowered.com/app/2458470/Spellcasters_Chronicles/"
  },
  "date_modified": "2026-02-02T21:35:00Z",
  "meta": {
    "status": "In Development"
  }
}